{
  "title": "CS50 - найкращий онлайн курс для початківців від Гарварда?",
  "subtitle": "Універсальний посібник для початківців",
  "author": "Сергій Городілов",
  "date": "2025-05-13",
  "keywords": [
    "review",
    "cs50",
    "programming",
    "beginner",
    "guide"
  ],
  "subject": "CS50 - Introduction to Computer Science",
  "category": "Review",
  "bibliography": "refs.bib",
  "abstract": "Ця стаття пропонує критичний погляд без прикрас на популярний онлайн-курс\nвступу до програмування CS50 від університету Гарварда. У ній розглядаються\nзміст курсу та методика викладання, а також наводяться характеристики\nособливостей його подачі та мета навчання. Досліджується чи є обґрунтованою\nрепутація CS50 як найкращого вступного курсу для початківців, аналізуються\nпереваги та недоліки. Стаття має на меті допомогти читачам сформувати власну\nдумку щодо доцільності вивчення CS50 для старту кар'єри в IT-сфері."
}
